{
  "id": "durante-la-nevada",
  "title": "Durante la nevada",
  "author": "Walter Schloff",
  "summary": "Durante una partida de rol en San Nicolás, Darío y Los Halcones Esmeralda quedan atrapados por una nevada mortal que convierte una casa familiar en el primer refugio de una catástrofe imposible.",
  "cover": "images/cover.jpg",
  "version": "0.1.0",
  "genre": "Ciencia ficción / Fanfic",
  "startPage": "p001",
  "totalEndings": 18,
  "pages": {}
}
