{
  "id": "demo",
  "title": "La casa de las trece puertas",
  "author": "Autor de demostración",
  "summary": "Una aventura breve de misterio fantástico entre pasillos imposibles y relojes detenidos.",
  "cover": "images/cover.jpg",
  "version": "1.0.0",
  "genre": "Misterio fantástico",
  "startPage": "p001",
  "totalEndings": 3,
  "pages": {
    "p001": {"id":"p001","title":"La verja abierta","text":"La lluvia termina de golpe cuando llegas a la verja. Detrás, una casa blanca espera con trece puertas rojas y una luz encendida en el desván.","image":"images/page-001.jpg","imageAlt":"Una casa antigua con trece puertas rojas bajo un cielo de tormenta.","choices":[{"text":"Golpear la puerta central","target":"p002"},{"text":"Rodear la casa por el jardín","target":"p003"}]},
    "p002": {"id":"p002","title":"El recibidor de los relojes","text":"La puerta se abre sola. Decenas de relojes marcan horas distintas, pero todos laten como un corazón. En una bandeja hay una llave amarilla.","image":"images/page-002.jpg","imageAlt":"Un recibidor lleno de relojes antiguos y una llave amarilla sobre una bandeja.","choices":[{"text":"Tomar la llave amarilla","target":"p004"},{"text":"Seguir el sonido del desván","target":"p005"}]},
    "p003": {"id":"p003","title":"El invernadero empañado","text":"El jardín conduce a un invernadero. En los vidrios se dibujan flechas con vapor, aunque nadie respira dentro. Una puerta lateral queda entornada.","image":"images/page-003.jpg","imageAlt":"Un invernadero nocturno con flechas de vapor en los vidrios.","choices":[{"text":"Entrar por la puerta lateral","target":"p004"},{"text":"Leer las flechas del vapor","target":"p006"}]},
    "p004": {"id":"p004","title":"La galería de retratos","text":"Llegas a una galería donde los retratos miran hacia una misma puerta azul. Al acercarte, un marco vacío empieza a copiar tu silueta.","image":"images/page-004.jpg","imageAlt":"Una galería de retratos antiguos apuntando con la mirada a una puerta azul.","choices":[{"text":"Abrir la puerta azul","target":"p007"},{"text":"Interrogar al marco vacío","target":"p008"}]},
    "p005": {"id":"p005","title":"La escalera que respira","text":"La escalera al desván sube y baja apenas, como si durmiera. Cada peldaño susurra un número. El trece suena más cerca de lo posible.","image":"images/page-005.jpg","imageAlt":"Una escalera oscura que parece moverse dentro de una casa antigua.","choices":[{"text":"Subir contando hasta trece","target":"p009"}]},
    "p006": {"id":"p006","title":"El mapa de vapor","text":"Las flechas forman un plano. Todas las rutas terminan en la galería, salvo una línea que atraviesa el suelo hasta una trampilla oculta.","image":"images/page-006.jpg","imageAlt":"Un mapa dibujado en vapor sobre cristales de invernadero.","choices":[{"text":"Volver hacia la galería indicada","target":"p004"},{"text":"Abrir la trampilla bajo las macetas","target":"p010"}]},
    "p007": {"id":"p007","title":"La habitación azul","text":"La puerta revela una habitación pintada como cielo de medianoche. Trece estrellas de papel cuelgan del techo; una cae en tu mano y se vuelve tibia.","image":"images/page-007.jpg","imageAlt":"Una habitación azul con estrellas de papel suspendidas del techo.","choices":[{"text":"Guardar la estrella y seguir al desván","target":"p009"},{"text":"Devolver la estrella al techo","target":"p011"}]},
    "p008": {"id":"p008","title":"El retrato incompleto","text":"El marco vacío responde con tu propia voz: “Toda casa guarda a quien desea quedarse”. Después muestra una puerta pequeña pintada detrás de tu sombra.","image":"images/page-008.jpg","imageAlt":"Un marco vacío con una sombra humana y una puerta pequeña pintada.","choices":[{"text":"Cruzar la puerta pintada","target":"p011"},{"text":"Retroceder hacia la galería","target":"p004"}]},
    "p009": {"id":"p009","title":"El desván de la campana","text":"En el desván hay una campana de cristal. Cuando la tocas, las trece puertas se abren a la vez y la casa exhala años de silencio.","image":"images/page-009.jpg","imageAlt":"Una campana de cristal en un desván iluminado por una ventana redonda.","isEnding":true,"endingId":"campana","endingTitle":"La campana despierta","choices":[]},
    "p010": {"id":"p010","title":"La raíz del pasillo","text":"Bajo el invernadero crece una raíz luminosa. Te ofrece una salida bajo la verja, pero al aceptarla olvidas por qué habías venido.","image":"images/page-010.jpg","imageAlt":"Una raíz luminosa abriéndose camino bajo una casa antigua.","isEnding":true,"endingId":"raiz","endingTitle":"La salida olvidada","choices":[]},
    "p011": {"id":"p011","title":"La decimotercera puerta","text":"La puerta más pequeña conduce al umbral que faltaba. Al cruzarlo, la casa se pliega como una cubierta de libro y deja una llave roja en tu bolsillo.","image":"images/page-011.jpg","imageAlt":"Una pequeña puerta roja abierta hacia una luz cálida.","isEnding":true,"endingId":"llave-roja","endingTitle":"La llave de regreso","choices":[]}
  }
}
